{
  "$schema": "https://json-schema.org/draft/2020-12/schema",
  "$id": "https://testmyagent.com/schemas/task/1.0.json",
  "title": "testmyagent task contract (task.json)",
  "description": "One task version. The layout and the names follow Harbor's task format (harbor-framework/harbor, src/harbor/models/task/config.py and paths.py, schema_version 1.4, Apache-2.0): a [task] package block, [metadata], [agent] and [verifier] with timeout_sec, [environment] with cpus/memory_mb/allow_internet, and the directories instruction.md, environment/, tests/, solution/. Differences from Harbor, on purpose: JSON instead of TOML; the verifier is a declared argv plus a report format instead of tests/test.sh plus a reward file; tests are split into tests/public (in the agent workspace) and tests/hidden (grading container only); the reference solution is a unified diff instead of solve.sh; editable_paths and protected_paths bound the patch.",
  "type": "object",
  "additionalProperties": false,
  "required": ["schema_version", "task", "instruction", "environment", "tests", "solution", "editable_paths", "protected_paths", "verifier", "agent", "est_minutes"],
  "properties": {
    "$schema": { "type": "string" },
    "schema_version": {
      "description": "Version of this contract format.",
      "const": "1.0"
    },
    "task": {
      "description": "Harbor [task] (PackageInfo): the package identity of the task.",
      "type": "object",
      "additionalProperties": false,
      "required": ["name", "version"],
      "properties": {
        "name": {
          "description": "org/name, as in Harbor.",
          "type": "string",
          "pattern": "^[A-Za-z0-9_][A-Za-z0-9_.-]*/[A-Za-z0-9_][A-Za-z0-9_.-]*$",
          "maxLength": 128
        },
        "version": { "type": "string", "minLength": 1, "maxLength": 64 },
        "description": { "type": "string", "maxLength": 280 },
        "authors": {
          "type": "array",
          "maxItems": 20,
          "items": {
            "type": "object",
            "additionalProperties": false,
            "required": ["name"],
            "properties": {
              "name": { "type": "string", "minLength": 1, "maxLength": 120 },
              "email": { "type": "string", "maxLength": 254 }
            }
          }
        },
        "keywords": {
          "type": "array",
          "maxItems": 30,
          "items": { "type": "string", "minLength": 1, "maxLength": 40 }
        }
      }
    },
    "metadata": {
      "description": "Harbor [metadata]: free-form, not used for grading.",
      "type": "object",
      "properties": {
        "title": { "type": "string", "maxLength": 120 },
        "tags": {
          "type": "object",
          "additionalProperties": false,
          "properties": {
            "tools": { "type": "array", "items": { "$ref": "#/$defs/tag" }, "maxItems": 20 },
            "concepts": { "type": "array", "items": { "$ref": "#/$defs/tag" }, "maxItems": 20 }
          }
        }
      }
    },
    "instruction": {
      "description": "Path of the Markdown instruction that the agent receives (Harbor: instruction.md).",
      "allOf": [{ "$ref": "#/$defs/relPath" }, { "pattern": "\\.md$" }]
    },
    "environment": {
      "description": "Harbor [environment]. `dir` holds the starting repository (the agent workspace root).",
      "type": "object",
      "additionalProperties": false,
      "required": ["dir"],
      "properties": {
        "dir": { "$ref": "#/$defs/relPath" },
        "install": {
          "description": "argv run in the workspace before any test, on the trusted side, with network. Lifecycle scripts never run: the evaluator always adds --ignore-scripts for npm. Default: npm ci.",
          "$ref": "#/$defs/argv"
        },
        "allow_internet": {
          "description": "Harbor name. Grading never has network on testmyagent; only false is accepted.",
          "const": false
        },
        "cpus": { "type": "number", "exclusiveMinimum": 0, "maximum": 4 },
        "memory_mb": { "type": "integer", "minimum": 256, "maximum": 4096 }
      }
    },
    "tests": {
      "type": "object",
      "additionalProperties": false,
      "required": ["public", "hidden"],
      "properties": {
        "public": {
          "description": "Directory copied into the agent workspace at the same relative path.",
          "$ref": "#/$defs/relPath"
        },
        "hidden": {
          "description": "Directory mounted at the same relative path in the grading container only, after the patch is frozen.",
          "$ref": "#/$defs/relPath"
        }
      }
    },
    "solution": {
      "description": "The reference solution, used only by the validation gate.",
      "type": "object",
      "additionalProperties": false,
      "required": ["patch"],
      "properties": {
        "patch": {
          "description": "Unified diff (git apply) against environment/, paths relative to the workspace root.",
          "$ref": "#/$defs/relPath"
        }
      }
    },
    "editable_paths": {
      "description": "Globs (workspace-relative; ** = any depth, * = one path segment). A changed file outside these globs makes the run invalid.",
      "type": "array",
      "minItems": 1,
      "maxItems": 50,
      "items": { "$ref": "#/$defs/glob" }
    },
    "protected_paths": {
      "description": "Globs that a patch must never touch, even inside editable_paths. Must cover the test directories.",
      "type": "array",
      "minItems": 1,
      "maxItems": 50,
      "items": { "$ref": "#/$defs/glob" }
    },
    "verifier": {
      "description": "Harbor [verifier]. `cmd` is an argv (no shell) run in the workspace root of a grading container. {tests} is replaced by tests.public or tests.hidden, {report} by the path the report must be written to.",
      "type": "object",
      "additionalProperties": false,
      "required": ["cmd", "timeout_sec"],
      "properties": {
        "cmd": {
          "allOf": [
            { "$ref": "#/$defs/argv" },
            { "contains": { "type": "string", "pattern": "\\{tests\\}" } },
            { "contains": { "type": "string", "pattern": "\\{report\\}" } }
          ]
        },
        "report": {
          "description": "Format of the report file. vitest-json = the Jest-compatible JSON of vitest --reporter=json.",
          "enum": ["vitest-json"],
          "default": "vitest-json"
        },
        "timeout_sec": {
          "description": "Wall limit of ONE verifier run (one suite).",
          "type": "number",
          "minimum": 5,
          "maximum": 600
        }
      }
    },
    "agent": {
      "description": "Harbor [agent].",
      "type": "object",
      "additionalProperties": false,
      "required": ["timeout_sec"],
      "properties": {
        "timeout_sec": { "type": "number", "minimum": 30, "maximum": 1800 }
      }
    },
    "est_minutes": {
      "description": "Estimated agent time shown in the catalog.",
      "type": "integer",
      "minimum": 1,
      "maximum": 30
    }
  },
  "$defs": {
    "relPath": {
      "description": "A relative path inside the task bundle: no leading /, no .. segment, no backslash.",
      "type": "string",
      "minLength": 1,
      "maxLength": 200,
      "pattern": "^(?!/)(?!.*(^|/)\\.\\.(/|$))[A-Za-z0-9_.@+-]+(/[A-Za-z0-9_.@+-]+)*$"
    },
    "glob": {
      "type": "string",
      "minLength": 1,
      "maxLength": 200,
      "pattern": "^(?!/)(?!.*(^|/)\\.\\.(/|$))[A-Za-z0-9_.@+*?-]+(/[A-Za-z0-9_.@+*?-]+)*$"
    },
    "argv": {
      "type": "array",
      "minItems": 1,
      "maxItems": 40,
      "items": { "type": "string", "minLength": 1, "maxLength": 300 }
    },
    "tag": { "type": "string", "pattern": "^[a-z0-9][a-z0-9-]{0,23}$" }
  }
}
